{
  "$schema": "http://json-schema.org/draft-07/schema#",
  "$id": "https://github.com/4PS-development/D365BC-vibe-page-scripting/workflow.schema.json",
  "title": "BC Workflow",
  "description": "Schema for workflow.json files used by Run-BCWorkflow.ps1 to orchestrate multi-user Business Central test sequences.",
  "type": "object",
  "required": ["name", "bc_url", "steps"],
  "additionalProperties": false,
  "properties": {
    "$schema": {
      "type": "string",
      "description": "Optional: reference to this schema file for VS Code IntelliSense."
    },
    "name": {
      "type": "string",
      "description": "Human-readable name for the workflow. Shown in report output.",
      "examples": ["Purchase Order Approval Process"]
    },
    "description": {
      "type": "string",
      "description": "Optional free-text description of what the workflow tests.",
      "examples": ["Multi-user workflow: Purchaser creates PO, Approver approves it"]
    },
    "catalog": {
      "type": "object",
      "description": "Optional catalog position. Informational back-reference to this workflow's place in the 3-level hierarchy (catalog.json is the source of truth).",
      "additionalProperties": false,
      "properties": {
        "value_chain": {
          "type": "string",
          "description": "Code of the value chain this workflow belongs to.",
          "examples": ["PRJ", "INK"]
        },
        "type": {
          "type": "string",
          "description": "Code of the type within the value chain.",
          "examples": ["VG", "PO"]
        },
        "process_flow": {
          "type": "string",
          "description": "Code of this process flow.",
          "examples": ["TRAJECT", "APPR"]
        }
      }
    },
    "bc_url": {
      "type": "string",
      "format": "uri",
      "description": "The Business Central environment URL. Found in your BC browser address bar up to and including the environment name segment.",
      "examples": [
        "https://businesscentral.dynamics.com/00000000-0000-0000-0000-000000000000/Production"
      ]
    },
    "steps": {
      "type": "array",
      "description": "Ordered list of workflow steps. Each step runs as a specific user and can capture values to pass to later steps.",
      "minItems": 1,
      "items": {
        "$ref": "#/definitions/step"
      }
    }
  },
  "definitions": {
    "step": {
      "type": "object",
      "description": "A single workflow step. Can be a BC page scripting step (bc-replay) or a direct BC API call (bc-api).",
      "required": ["id", "name", "user"],
      "additionalProperties": false,
      "properties": {
        "id": {
          "type": "string",
          "pattern": "^[a-z0-9-_]+$",
          "description": "Unique identifier for this step. Used in depends_on and capture expression references. Lowercase letters, numbers, hyphens and underscores only.",
          "examples": ["create-po", "approve-po", "create-customer"]
        },
        "name": {
          "type": "string",
          "description": "Human-readable name for this step. Shown in the report.",
          "examples": ["Create Purchase Order", "Check PO with approver", "Create Customer via API"]
        },
        "user": {
          "type": "string",
          "description": "The role key that maps to a user entry in users.json. For bc-api steps, use 'system' (or any role key) to indicate the swim lane position.",
          "examples": ["purchaser", "approver", "system"]
        },
        "company": {
          "type": "string",
          "description": "Optional BC company name for this step. When set, '?company=<value>' is appended to the bc_url for this step only. Useful when different steps must run in different companies within the same environment.",
          "examples": ["CRONUS International Ltd.", "My Company"]
        },
        "type": {
          "type": "string",
          "enum": ["bc-replay", "bc-api"],
          "default": "bc-replay",
          "description": "Step type. 'bc-replay' runs a YAML page script via npx replay (default). 'bc-api' calls the BC REST API directly using an Entra ID app registration."
        },
        "script": {
          "type": "string",
          "description": "Relative path to a single YAML script file. Used when type is 'bc-replay'. Use either 'script' OR 'scripts', not both.",
          "examples": ["./scripts/create-po.yml"]
        },
        "scripts": {
          "type": "array",
          "description": "List of YAML script files to run in sequence for this step. Used when type is 'bc-replay'. Use either 'script' OR 'scripts', not both.",
          "minItems": 1,
          "items": {
            "type": "string",
            "description": "Relative path to a YAML script file."
          },
          "examples": [["./scripts/step1.yml", "./scripts/step2.yml"]]
        },
        "app_registration": {
          "type": "string",
          "description": "Key into app-registrations.json that provides the Entra ID app registration credentials for this API call. Used when type is 'bc-api'.",
          "examples": ["bc-custom-api"]
        },
        "method": {
          "type": "string",
          "enum": ["GET", "POST", "PATCH", "PUT", "DELETE"],
          "description": "HTTP method for the API call. Used when type is 'bc-api'. Defaults to 'GET'.",
          "examples": ["POST", "GET"]
        },
        "endpoint": {
          "type": "string",
          "description": "The BC API endpoint URL. Supports {{tenantId}}, {{environmentName}}, {{companyId}} placeholders (resolved from app-registrations.json) and {capture.stepId.varName} capture references. Used when type is 'bc-api'.",
          "examples": [
            "https://4psconstruct.api.bc.dynamics.com/v2.0/{{tenantId}}/{{environmentName}}/api/4ps/custom/v1.0/companies({{companyId}})/customers"
          ]
        },
        "body_template": {
          "type": "object",
          "description": "JSON body to send with the API call. Values can contain {capture.stepId.varName} references that are resolved at runtime. Used when type is 'bc-api'.",
          "examples": [{ "no": "{{no}}", "displayName": "Test Customer", "city": "Amsterdam" }]
        },
        "capture_response": {
          "type": "object",
          "description": "Values to capture from the API response JSON. The key is a variable name; the value is a JSONPath expression (e.g. $.id, $.no). Captured values are available to later steps via {capture.stepId.varName}. Used when type is 'bc-api'.",
          "additionalProperties": {
            "type": "string",
            "description": "JSONPath expression into the API response. Simple dot-paths supported: $.field, $.field.nested.",
            "examples": ["$.id", "$.no", "$.systemId"]
          },
          "examples": [{ "customer_id": "$.id", "customer_no": "$.no", "customer_systemId": "$.systemId" }]
        },
        "depends_on": {
          "type": "string",
          "description": "Step 'id' that must complete successfully before this step runs.",
          "examples": ["create-po"]
        },
        "capture": {
          "type": "object",
          "description": "Values to capture from the BC page after this step runs (bc-replay steps only). The key is a variable name; the value is 'Page Title - Field Caption' as it appears in BC.",
          "additionalProperties": {
            "type": "string",
            "description": "The BC field identifier in the format 'Page Title - Field Caption'.",
            "examples": ["Purchase Order - No."]
          },
          "examples": [{ "po_number": "Purchase Order - No." }]
        },
        "inject": {
          "type": "object",
          "description": "Field values to inject into this step's YAML script before running (bc-replay steps only). The key is 'PageTitle.FieldCaption'; the value is a {capture.stepId.varName} expression.",
          "additionalProperties": {
            "type": "string",
            "pattern": "^\\{capture\\.[a-z0-9-_]+\\.[a-z0-9_]+\\}$",
            "description": "Capture expression: {capture.<stepId>.<variableName>}",
            "examples": ["{capture.create-po.po_number}"]
          },
          "examples": [{ "Purchase Order List.No.": "{capture.create-po.po_number}" }]
        }
      },
      "if": {
        "properties": { "type": { "const": "bc-api" } },
        "required": ["type"]
      },
      "then": {
        "required": ["endpoint", "app_registration"]
      },
      "else": {
        "oneOf": [
          { "required": ["script"], "not": { "required": ["scripts"] } },
          { "required": ["scripts"], "not": { "required": ["script"] } }
        ]
      }
    }
  }
}
