{
  "name": "test",
  "description": "",
  "bc_url": "https://4psconstruct.bc.dynamics.com/8f94bd30-45c4-40a9-9898-8dd15063a020/FpsDemo",
  "steps": [
    {
      "id": "step-1",
      "name": "Step 1",
      "user": "testrole",
      "script": "./scripts/Aanmaken Traject.yml"
    },
    {
      "id": "step-2",
      "name": "Step 2",
      "user": "testrole",
      "script": "./scripts/create-po.yml",
      "capture": {
        "purchase_order_no": "Purchase Order - No."
      },
      "depends_on": "step-1"
    }
  ]
}